160738567549763585,Hallado el cuerpo sin vida de una mujer en el interior del 'Costa Concordia' http://t.co/G4z8v5Gu,N
797162520897290240,"Extraño las clases de biblia del Pastor Manzanares y sus no tareas , aún no supero que se haya ido",N
814342472952320000,Mi hermano está templadaso y se me hace tan lindo,P
146471403909169152,"Rajoy:''Intentaremos repartir de manera equitativa los costos de esta crisis económica. La primera obligación de un gobernante es ser justo""",NEU
162880717108416512,"Montoro: ""Todas las administraciones deberán aprobar sus reglas de gasto"". Me gusta que haya un gobierno que gobierna.",P
804074641685958657,"Entran a la oficina y dicen ""Sólo les voy a pagar a las que no vienen con escotes pronunciados"".",NEU
166665433653592064,Estaré de nuevo en Madrid el lunes 5 de marzo en el T. Circo Price !,NONE
142536698188931072,Viernes negro: Aumenta el paro en Noviembre y disminuyen los afiliados a la Seguridad Social; esta es la triste #HerenciaPSOE,N
151760673163059200,La Diputación redescubre un mural del pintor Francisco Hernández que llevaba 12 años oculto http://t.co/iBGbSHSf,P
802208923956563969,la culpa la tiene el inutil del partner q m toco  x eso no se si llegare a tiempo a las 4,N
808883029825490944,"Vuelvo y repito y reitero: extraño mucho snapchat, era mi app favorita",NEU
178769462697279488,"#11Mconlasvictimas ,con el dolor de una país que sufrió la barbarie,con una ciudad q se desgarró,con un pueblo q no puede olvidar, ni quiere",N
150140235911675904,Igulmente #FF RT @javiercreanto: Queridos malageños felices fiestas! @Soastec @Blocdeesbozos @jakarrion @mariviromero,P
786320557142839296,"@ManuelDezGalian no, pero a las 7:10 si ",NONE
167544497490755584,El presidente tiene que llamar la atención a los diputados por el ruido que montan en la cámara durante la intervención de Carlos. Ni caso..,N
184606436632969217,El TS condena a unos padres a pagar a sus vecinos 8.000 euros por el ruido de sus hijas al piano.,N
806331090470313985,"Bueno, Yixing tuvo pocas líneas como siempre, pero no voy a andar de pesada. Al menos no esta vez",NONE
768529047878004736,"@GarbiMuguruza 
Yo cuando pueda quiero tener el Omega Constellation,, con los numéricos romanos. ",P
178134316667252737,"De San Sebastián tenían que ser, Fede, de San Sebastián... @FedericoQuevedo @joelareina",P
176953177629921281,El empleo es el eje central de nuestro programa. Para ello hay que fortalecer el tejido productivo con empresas competitivas #forojoly,P
163343417739448320,"Nuestro amigo @benjagladiador fallecio el dia de hoy, llevaba tiempo luchando contra el cancer... Buen viaje amigo.",N
177394055880245248,Video Minuto de hoy de @esperanzaona #elcambioandaluz http://t.co/tHL5fyuO,NONE
156664473858478080,"Avanza el caso Noos: imputado Jaume Matas y también el apoderado de Aizoon  SL, una de las empresas de los duques http://t.co/AdQmhBfC",N
768108422806069248,En fin @kenneos espero que recibas este tuit en otra realidad alternativa donde sigues viva porque ahí no se acaba tu camino  ¡suerte!,P
167182760002330625,Uno no sabe cuando parar.#saquenmedeaqui http://t.co/tQPnmf8Q,N
770571712761069568,"@Vic_Phantomhive Nah, que soy un pringao que lleva aguantándole mucho y ya estoy cansado ",N
782056091878354944,"No, la verdad es que no sé qué haré por el cumpleaños de Yixing. O sea, ¿han visto todo lo que hacen las xingmis? Son muy lindas",P
808498067859275776,@AdvyStyles Dios por mi le daría todo mi dinero pero no tengo y soy menor no tengo tarjeta de PayPal Dios que mal la debe estar pasando,N
154886659635294210,RT @microsiervos: Una nueva tecnología de Sony que convierte el papel en energía (@sonyericssones) http://t.co/5uNj5UJV,P
183283902008410113,"Ofrecemos un gobierno decente, de soluciones y que apoye el talento, que es mucho y nos sobra en #Andalucía. #votaPP",P
770228393799520256,Ojalá alguien llamandome bonito o precioso  sad,N
147551473906089984,Buenos días. Estudiando la prensa en @ABCPuntoRadio.,NONE
770262568703291392,@LorasTyrellSer Yo también te puse algo bonito. Cuanto desprecio ,NEU
813598741659787265,"Escuchando la hora ""hot"" de ""qué paja"" en radio moda",NONE
151331264488681473,"A los que os habéis quedado sin entrada, lo siento mucho, no sabia que había tanto interés (sobre todo porque es una quedada chorra)...",N
169142449078415362,“@BorjaThe1: @Edurnity Dónde se puede ver Grease ??? Un beso guapa ;)” En el teatro Arteria Coliseum en Gran Vía ,P
770987688551936001,Típic Te levantas de noche para ir al baño y corres lo más veloz que puedes para que el fantasma no te alcance ,N
181638499710148608,Fotos enormes de la #F1 en las portadas de @el_pais y @abc_es. Hace 24 horas que acabó la carrera. Feliz lunes.,P
149976060694507520,“@El_Plural: El PP usa el rodillo para volver a “exiliar” a Azaña y aparta su busto 24 días después de su inauguración http://t.co/Qw8sGZbJ”,N
169775612960047106,Y este @reciomanolo desafiante... Si los controles los has inventado tu.....http://mun.do/AxnUyb,N
156475258252173312,"como los impuestos?“@sgueina: ""lo fácil debe ser contratar y lo difícil despedir"" (ministro Soria)Se lo pongo barato oiga barato(el despido)",N
770204764709740544,Ha muerto mi profesora de volumen/escultura y en serio que bajonazo ,N
176646859736100865,Nuevo post en mi blog http://t.co/HPCiH1hh,P
149044193950580737,Muy refranero..;-) RT @EndikaAmpudia @Tonicanto1 como estas viendo a Josu Erkoreka?,P
770985296007659521,"Me parece q en esta edicion blogs @iAgua la 4a posicion será la + reñida 
@hidrojing @jcponline @MarinaArnaldosO https://t.co/8HLHYxOX55",NEU
186428884693159936,Lágrimas y Favores #cofradiasMLG #malaga   @ Calle Martinez http://t.co/xDpCkhDv,NEU
177317837579354115,Somos parte de IU y queremos ser parte de un frente amplio de la izquierda política y social. Con apertura de ideas y organización.,P
160996128916115456,"Salgo para el Congreso Provincial del PSOE. Esta mañana en Badajoz y Cáceres, debates y votaciones.",NONE
154144063459835905,Que tengáis un gran día!!! Animo!!!,P
187464666098827264,"""Si un violador está libre, el sistema judicial está fallando"" http://t.co/4hw5u5gk",N
769887832194318336, por qué dices eso? Yo soy otaku y no hablo casi de aniJAJAJAJA era broma sis,NEU
174796629944188928,Compre la Mezquita de Córdoba es trending topic. Gracias. (va de este artículo en mi blog http://t.co/k0nkU7JO ),P
174625942994567168,"Para saber sobre como se las gasta  la dictadura de Qatar recomiendo viaje,ya no tendrán dudas sobre el patrocinador del Barça...",N
165010140108566528,Menéame (si quieres): Las excusas de Wert http://t.co/wDc73iLK,N
809138354302357504,Lo bueno que mñn acaba sus finales,NEU
758451150349664256,"Mmm no quiero hacer spoiler pero hoy va a ver algo nuevo en el canal,lo podras ver en el nuevo video que subire en unas horas",NEU
818655949795823616,No entiendo la actitud agresiva gratén de tuiter. Si te jode lo que digo no masoquees y no me sigas. Es lo sano,NEU
819423188580966400,D.O eres genial ...Feliz cumpleaños y q sean muchos años más #E #EL #KPOp,P
189635159266574336,"Rajoy, a la pista http://t.co/K93M3dfA",NONE
801279880247713792,"Que enfermería tenemos, Gareth Bale se podría perder el clásico",N
771807457567965184,"Acabo de comprobar en Linkedin  si eras mi antiguo alumno, tengo un gran recuerdo @alexldguevara  Te deseo lo mejor @vlcextra",P
815444241107140608,@chifaentiffanys no soy emo!!!! … feliz año!!,NONE
803256972237619200,En la vet pq Aslitan está enfermito ...Hay una Sra. que está llorando pq a su perrito lo están operando,N
169730285376774146,Las obras comenzarán después de verano y se prevé que sea una realidad a principios de 2014 #sevillahoy,P
770594679255556100,"Ha ardido una caravana aparcada al lado de la playa  
Fuego ya sofocado por los bomberos @… https://t.co/LgbW9ryGWy",NONE
776104226363699200,@madshila @soleyvelez @CarlosJRubiofm y ahora sonando @sinbandera #CancionesDeAmorEnFanatica excelente,P
768772572754436098,@GordoMaestro No lo soy lemado ,NEU
179973129853079554,;-)) RT @Emprenderioja: @mariviromero que sean dos! Cc/ @GanasdeVivir,P
165834178439553025,"Ahora! Q trabajito RT @europapress_es: Rubalcaba, elegido nuevo Secretario General del PSOE #38CongresoPSOE  - http://t.co/mGql24My -",P
770570987091980288,"@umaprepon @beyondhell_ @ohwowfuckyou_ 
No os habéis dado cuenta de que la puesto El verdaderx fotógrafx...EL solo puede ir con masculino ",N
153279586715697152,Hoy no amigos hoy un poco de familia mañana sera otro dia,NONE
165448456712892416,La hora que es y ni un díario he podido leer. Me pone nerviosa sentirme OUT...,N
153221026682109952,"""@albagarcii: hijo de puta, mal cancer te entre"" Gracias! Pues a ti un sagitario, ideal para emergencias de primera necesidad.",N
165790373048885248,¿Chacón o Rubalcaba? Nevada histórica en Mallorca. Vencer al cáncer. El día + cruel d la represión en Siria. A las 15h en @informativost5,N
184148130646867968,El dia 2 de Junio tocare en el estadio Vicente Calderon para celebrar los 20 años de Cadena100 .. Me llevo toda la artilleria pesada. ;),P
179151116699836417,11M.- El presidente canario Paulino Rivero lamenta la revisión de los atentados y lo atribuye a la presión de grupos mediáticos.,N
164060503533031424,Lo que le faltaba al logotipo de Madrid 2020. Una empresa de juguetes gays acusa a sus creadores de plagio. http://t.co/2EqkP9xq,N
174442287290527744,"El líder del PSE de Álava, Txarli Prieto, ve ""razonable"" que se busquen ""vías de diálogo"" con la izquierda abertzale ""siempre, para avanzar""",P
818926529778511872,"@Phoemi Hola! en estos momento van chequear tu solicitud para poder ayudarte lo antes posible, lamentamos el retraso",NONE
810669947105972224,La final de @YoSoy_Peru esta esta muy interesante,P
189596270992687105,Portada Marca http://t.co/i2wfib29 ...,NONE
768333118239412224,Viendo con mi gordiflaqui LOCA POR LAS COMPRAS y el diciendo se parece un poco a ti o tu a ella jjajajajaja yo no compro tanto,NONE
771082813777047552,Estoy muerto de hambre pero no puedo hacerme la cena todavía porque está mi compañero de piso cenando y no quiero cenar con él ,N
771036947108200448,Los ministerios q os tienen a vosotros engañando maca conmigo tenías q dar @Rafa_Hernando q t iba a dar un baño así d paso t lavas l boca ,N
761946875654184960,"Solo tengo que decir estés dónde estés, estés con quién estés, aún te extraño... extraño que me revientes el hígado, oh, pisco amigo mío.",NONE
174050759116206080,"Financian Times consigue 267.000 suscriptores digitales, 44% de su circulación de 600.000, récord de difusión de pago http://t.co/hpes1HBC",P
145237361066917888,"Ironía, por qué le abandonas.",N
808706648206352384,Estaba durmiendo tan ricooo jaja que cólera que me dio cuando me despertaron,N
804647042526183424,Sigamos siendo felices felices felices,P
177821791794900992,El gobierno catalán sólo da dinero a las ONGs que hagan todo en catalan. La beneficiencia sí discrimina... @TelediarioInter 20:30,N
817563885024776193,@Mcquensi yo quería uno. Pero me subía mucho el precio del nuevo playot,N
151447668013543424,"Niños y niñas, ahora SI podéis mirar Tenéis que hacer caso de las indicaciones del tío Santiago je je je http://t.co/gdtgUPWr",P
164775149789384704,Los del movimiento #yonopago vuelven al ataque. En el centro de Madrid están liando una buena,N
818540429478076417,@EstefLescano me siento triste amiga,NONE
162231816353349635,"De camino a ""El Hormiguero"" a preparar las explosiones de esta noche...",NONE
157071219030638592,Hoy no le tiembla la mano. Ayer cueste lo que cueste. Y durante toda la crisis la austeridad hipócrita como ley del embudo y el rigor mortis,N
769661441502838785,"Os lo pido por favor en serio, es muy importante para mí  🙏
https://t.co/STUwLW8brK",NEU
157863302108680192,"Acaba de llegar a #elcambioandaluz el Ministro de Hacienda y Administración Publica, Cristóbal Montoro http://t.co/jVzEJt2s",NONE
814579029319811072,"@IkebanaBlossom Yo, he probado con pisco, y buenazo tmb, ah.",P
170938507148267520,Dentro de 30' estaré en Radio Marca con Edu García SinTacos para comentar el partido del Madrí.,NONE
184746133279604736,"La UE prevé que España suba impuestos, todo listo para la huelga y la renta mínima de inserción, amenazadahttp://t.co/jXmep9Rn#portadaEPC",N
770742913684873217,Votado en este no en el otro ,NONE
767869735266557952,A ver que asi a lo tonto me quedan solo 2 dias en Galicia. ,NEU
183266966218350592,"Cuando la marea azul invade España, aquí tenemos la blanca y verde!!!",NEU
158163978047062017,""" #Andalucia fue la punta de lanza del cambio en 22 de Mayo y el 20 de Noviembre"" @marianorajoy #elcambioandaluz  http://t.co/WfUdeQiz",NONE
165821111135768576,A punto de Rdo. #38congresopsoe,NONE
176966238059245568,"En el @gobierno_aragon tenemos claro el compromiso con el déficit, pero mantenido el gasto social q incluye Educación, Sanidad y Dependencia",P
154486471624105984,Andalucía cierra el año 2011 con 969.152 personas en paro http://t.co/xUQvUWS9 via @elmundoes,N
170949452658515968,"alineación en el PP: Cospedal, secretaria general; Pons, Floriano y Arenas, vicesecretarios - ABC.es http://t.co/HKF5C2Kq via @abc_es",NONE
182783232650125312,RT @Mari_Estopera:Yo me iba a ir a limpiar hasta que descubri el concurso de @Buenafuente y aqui me teneis pensando que poner en la camiseta,P
769864074582712321,@EyeOfDavid__ te conocí y ya no te he vuelto a ver  me pareces super sincero y leal y me gusta hablar contigo,P
771692441611145217,@iChuso Que ya ha empezado tio ,NONE
769985604725637121,@ratgull @Vespacityman @Kellydeharo @ELpuebloMALDITO Al final ha sucumbido el maldito a nuestra dura mano ,P
178781278668197888,El poema del domingo (Claudio Rodríguez) http://t.co/S2NzLFC5,NONE
159364227549765633,Ya!,NONE
146663729621237760,Hasta hace nada te robaban reclamando la bolsa o la vida. Ahora desde la bolsa parece que nos roban la vida sin reclamar.  Mañana me entero,N
817850221782769668,@eaum8 Por lo menos podría traernos una postal del Santiago,NONE
145621830265348096,No se como agradecer todas las muestras de cariño q he recibido hoy aquí y fuera de aquí...No tengo palabras. Gracias infinitas,P
177828481755922432,Alguien me pasa link para ver rueda de prensa en ESPAÑOL en el Departamento de Estado @StateDept Gracias!,P
183838397570359297,ahora con @Ana_Torroja en Protagonistas fin de semana!!,P
162796233407205376,A por el viernes ;-)) (@ Ayuntamiento de Málaga w/ @jesusespino) [pic]: http://t.co/ZXUEIQ95,P
172077291269132289,Nosotros también somos el enemigo y no pensamos irnos a Laponia. Nos quedamos aquí a defender nuestros derechos.,NEU
818682475614445568,"Si pudiese cantar bonito no dejaría de hacerlo con ""Come what may"" de Moulin Rouge",NONE
154506683090075648,Buenos dias...  Hace un dia precioso..,P
162652001153449985,"Si nos deja el gran jefe hacemos noche electoral desde WDC , te imaginas? Aunque los REP ganaran x 5 puntos @trasgodegaceta @piichonciito",P
158552715914522625,Ya dentro del avion con @Kataly91 A dormir un poquito ahora y dejar una horita en el aire... http://t.co/BmdqgFwQ,NONE
810345073091211264,"@MoisesDelgadoG Gracias primito, le haré presente los saludos! Estás invitado si puedes vienes",P
143316804259942400,Retazos de una primera dama http://t.co/168s72nj,NONE
796788190279598080,"@MauFonseca11 @FexCR el otro muchacho que es nieto del señor de las galletitas, siempre tuvo una dulce navidad",NONE
156364764547784704,"Espero no acabar igual “@FGSH: no he leido EPN todavia, pero leyendo el libro de A.Politkovskaya veo paralelismos en su lucha y la de Vd.”",N
771695148568813569,"@Pedro_GarMu uy qué bien me vendría para colocar la WiFi, el portátil, las flautas, el saxo, el nariclete, las partituras y mi desorden ",P
173853612458524673,El problema de la estrategia jurídica de Urdangarin es la respuesta de Torres ¿Aceptará su socio comerse el marrón? A lo mejor si.,N
177324889282318336,El Psoe acusa a Gallardón de imponer en el aborto una moral ultra. El ministro asegura defender el derecho de las mujeres a la maternidad.,NEU
161023039423774720,Acabo de leer un poco por vuestras fotos y me parece q marca quiere sacar las cosas de quicio pq ese tipo de dialogo suele pasar.,N
769987339187814400,"@DavidArizaAbad buenas noches, David  un abrazo!",P
157834539962597377,Terminando de comer con @sneijder101010 y su mujer @yolanthecabau en el Hotel Bulgari. Just finished eating at the Bulgari Hotel.,NONE
767730342723743744,lo mejor es que son conversaciones normales y corrientes sin ningún ánimo de ligar pero  simplemente porque no se ligar ,NEU
768530150002716672,"Ah vale, me suelta la puta subnormal, te estoy llamando. 
Le digo que no me sale y dice ""ah, es que tengo el wifi apagado"" ",N
167904056151523328,Para @colegas educar en valores no es gastar mas. Es planificar una estrategia seria y coordinada #LGTB @esperanzaona @rafa_moral,P
173888293136637952,Voy a cenar! Ciao!;-),P
189072701745414144,"Gracias a todos. Aunque no os lo creais, sonrío bastante. La fe mueve mas que montañas ;-)",P
176795374676226048,El fundador de Slashdot se pasa al WashPost RT @NiemanLab Why @cmdrtaco joined WaPo “Journalism is bigger than print” http://t.co/WQO0YHHX,P
184653380671651841,"Intervención de @anapastorPP ministra de Fomento en Senado, confirmando #AVE a Talavera en el eje  #Madrid-Extremadura http://t.co/gCXthIo7",NONE
168255707915886592,"""Esta es una reforma en la que todos ganan, empresarios y trabajadores"", dice Rajoy en el BOE #reformalaboral",P
149439374713556992,¡Noticias descombacantes! está disponible! http://t.co/pdWFYyRa ▸ Historias del día por @accioncine,P
185272400735252481,Ambiente en Gran Vía http://t.co/2DWu1pi4,NONE
147425135459184640,@anapastor_tve si acaban de confirmarmelo. El psoe dice q el informe es infumable,N
160450526813757440,Una lástima no poder estar el 4/2 en la de despedida de Palermo. Justo homenaje para alguien q se merece todo http://t.co/0DMPmEk4,P
182907085938360322,"ERC: los toros en Cataluña, con la Legión. @TelediarioInter 20:30",NONE
174028228577591296,Portada  20 Minutos - Bilbao http://t.co/MvKCMFX0 ...,NONE
184291568814002177,Y la corrupción sigue... Detenido el 'número 2' de la Diputación de Barcelona por tráfico de influencias http://t.co/YbCOS6ro,N
173063093197357056,"@PauladeLasHeras Gracias, aunq otros no piensan igual. Las tuyas suelen quedar mucho mejor. Besos",P
157045795726692353,"Montoro dice que pide ""un esfuerzo pequeño de muchos"" con la subida de impuestos. Y defiende los impuestos ""a la propiedad"". Ver para creer",N
768221021300264964,Vale he visto la tia bebiendose su regla y me hs dado muchs grima ,N
188689114109972481,A merendar #chatidieta  http://t.co/Fs6j0PWJ,NONE
172082426342940672,Cenando con @josecorbacho @ChristianG_7 @MercheOficial  y @manuelbueno85 con esta compañia se cena bien agusto...me falta @jessica_bueno90,P
770159312580800512,"@emedemo holaaaa de origen vegetal  nunca nunca nunca de origen animal, buen día ",NEU
160841844278837248,"“@IratiKerplunk: Acabo de ver #lachispadelavida.tengo algunas palabrillas que decir: brillante, brilante, brillante!! gran pelicula. Gracias",P
770717151120465920,Encantado @juanl_cruz  estás siempre bienvenido. Espero visitaros en Málaga antes ,P
806979207674916865,@Jaspn_ Yo voy de fijo. Ahora llamo a reservar,NONE
183321209969192960,"Sin vosotros no soy nada. Con la fuerza del sur, ganaremos el futuro. Nadie nos va a poner de rodillas.",P
149223640980922368,Preparada para la cena con los compis...chapa y pintura en 10 minutos...hoy he batido todos los récords,P
770254835669168128,"@TheFuzzCanyon gracias por etiquetarme, pero no suelo hacer estas cosas ",NEU
817211593398304770,"Quiero decirte, hola, como estas? Pero... los check azulitos me dan miedo",NEU
142521019171749888,abcdesevilla.es: Recio no tiene «indicios potentes» para denunciar a los responsables de los ERE http://t.co/wlDSs1yQ,N
173761566175539200,Aquí el campeón de la #experienciaCandado : @borissoler ;-)) todo un profesional del padel http://t.co/xQNFxbjk,P
769912424677924864,"@Zimlaar ¿Solo te preocupa el número de followers? Me lo imaginaba... jaja 😂
Ellos mismos piden que haga quedada ",NEU
798356108473696256,"Un País tan afectado como Haití, necesita del mundo entero.",NONE
179695800589365250,"""El cuaderno de Maya"" me tiene enganchaíta. Primer libro que leo de Isabel Allende y me gusta mucho",P
164119455138447361,. @reciomanolo por que debe usted 126.000 e a este taller de empleo ? Donde esta ese dinero se las personas con discapacidad?,N
152715163861131264,Mi último #FF del año es para mis followers. Gracias x estar ahí. Gracias x vuestros tweets. Gracias x vuestro cariño. ¡Feliz 2012 familia!,P
187476203911909376,Feliz semana santa para todos los twitteros y en especial para mi amigo @javipp_84 .,P
146899349480280064,Firman el contrato para las obras del bulevar en #Malaga  - La Opinión de Málaga http://t.co/OePvg741,P
169703514413608960,Héroes y heroínas de hoy by @ajemalaga  http://t.co/t443QPWO,P
167896873095544833,"Dispuestos a comprar contenidos de pago, pero más baratos y con gran desconocimiento de la oferta ya existente http://t.co/ou4eAYfM",NEU
146918553763852288,PSOE-A no acepta ninguna de las 443 enmiendas de la oposición al Presupuesto http://t.co/rrrqXcbS,N
810844450947731456,"El tipo al que reemplazo se fue dejando todo el área lleno de problemas, encima llamo y apaga el celular",N
148790336364363776,Rubalcaba le dice a Rajoy que tiene sospechas de que puede recortar derechos. Rajoy ni le mira. #investidura,N
185969766354268160,"Compartido, pero dedicado a @sarasolomando : Ves? Ya vuelve a salir otra vez /  #sarainformanos http://t.co/DdmJrWnY",P
167223204878884865,"Rubalcaba: ""Socialistas franceses y socialdemócratas alemanes tienen posiciones que convienen mucho a España, ojalá ganen""",P
158486668549165056,SI! RT @AnaVazquez39 @Tonicanto1 Me haces RT?   http://t.co/tAKHWNdV,NONE
168381093270138880,"Mucho en juego.Ayuda militara Egypto puede cortase. "" Top U.S. general discusses NGO case in Cairo"" http://t.co/hFQoOP5v vía @r euters",N
158466777595133953,Guindos propone controlar a las autonomías y Montoro le matiza. http://t.co/x5xsRBwD Ya me extrañaba a mi!!,NEU
802610197306802176,"@CamposGeovanni en eso estamos claros, pero yo tengo fe en que los ticos somos solidarios cuando mas se necesita",P
168236749665996800,"Oído en la calle: ""esto va de sangre, sudor y rajoy""",N
769712850193551360,"@ivancastello Toca un tema maravilloso, porque sin dejar de ser ficción es algo que podría darse. Un Gran Hermano vol.02 ",P
770027650610003968,@zKnowcks7 la culpa es de la gente que juega segunda no te engañes a ti mismo ,N
151350734540124160,"Empieza el debate, por José Borrell http://t.co/FsJJBLAx",NONE
187582347120619520,Exaltación . El trono de @JuanMa_Moreno . Para ti Juanma que se que te estas acordando c/c @ManuelaVillena http://t.co/7bzlStvU,P
156714884556525568,"¡Ánimo, valiente! RT @conchagcampoy Muchísimas gracias a todos.Tengo leucemia pero también ánimo de lucha, buenos médicos y muchísimo afecto",P
177727213037293568,"Deudas de los ayunt. Álvaro habla de la deuda de 40.000 millones, y de como la mayoría de esa deuda ha sido provocada por ayunt del PPSOE",N
816079943423709185,Con mi tamaño y una tractora se atrevió a usurpar mi espacio personal en el bus. Nada las detiene; parezco una sardina.,N
183869676760219648,“@maximhuerta: @David_Busta Treinta!? Bien vividos! Un abrazo fuerte estrella.”Muchas gracias querido!!!,P
814552975876194305,No me molestaría si me quieren regalar una camara polaroid ah,NONE
171913144728428544,Rosa10 denuncia el intento del PP y el PSOE de aislar a UPyD y no a Amaiur http://t.co/33CdaIMm,N
142424715175280640,"RT @FabHddzC: Si amas a alguien, déjalo libre. Si grita ese hombre es mío era @paurubio...",NONE
770042393433403393,"@Juanjok Mira q me gustaría, Juan, hablar contigo con emoticonos, pero está visto que ntros móviles no son compatibles! ",NEU
162601637867827200,Buenas noticias en Davos?.Esta es sorprendentemente buena.@lbasets http://t.co/sF3AQqHy,P
186098072252723200,@mjguemes Disfruta que te lo mereces mucho! Embarcando... ;),P
186024613090836480,Hoy Pleno en @malaga   @ Ayuntamento Malaga http://t.co/RdBAdOuK,NONE
771057046296879104,"@crisasanz gracias, guapa!! menuda promoción me haces!! eres un sol ",P
146518709379411968,@PalomaCervilla También han aprobado siete portavoces adjuntos y han ratificado a Teófilo de Luis como secretario técnico. Besos,P
161573609880567809,"Jajajajaj RT @ALIandCIA: RT @vasconita: Acepto ""gato satánico"" como elemento decorativo. http://t.co/RziD5y1P",P
816684107421851648,"@LoboDeAndunie que buena, esos alucinados que fingen ser Lobos, y esos que fingen ser gay y no saben nada de nosotros",NONE
158537780455157760,"Angel Luna, el azote de la corrupción del PP en Valencia explica porque apoya a RbCb http://t.co/StBXX1IY",N
142957892537024512,"Con Fina, mi mujer, amigos y el reparto de ""Iceberg"", nueva película de Gabriel Velázquez.Por Gabri no pasan los años. http://t.co/n2chJhTr",P
170071620369645568,En el blog: Al fin la patronal está contenta http://t.co/YzPmygoU,P
179330788632956930,@FedericoQuevedo Gracias!!!! Mil besos,P
173378299093983232,“@DeborahBelieve: @David_Busta Le mandas un besito a mi abuela? Esta en el hospital y necesita mimos :)” UN BESAZO ENORME!,N
182165267726602241,Las fotos son de Cabo de Palos y del Mar Menor,NONE
145480603125547009,@JuanMoscosodelP animo.y ojo,NEU
