171944706350125058,"Comunidado SUP protestas Valencia http://t.co/J9ywoeEK Sobre las palabras del Ministro dicen ""políticamente cobarde y moralmente miserable""",N
809382645754957825,Toda mi familia va a estar dormida en mi graduación,N
174035810545442816,"""Es un éxito formidable del cine francés, del cine de calidad"",aseguró Sarkozy en la radio RTL, tras el triunfo de ""The Artist""en los Óscar",P
770026405144952834,Tengo dos orzuelos enquistados en el ojo izquierdo y me hacen la cara muy asimétrica. Me veo raro ,N
160238749874262016,Ayer tuve una reunión con el Gremio de Joyeros. Vamos a hacer un esfuerzo para proteger a un sector que está... http://t.co/ZGuEusOw,P
186780038140665856,"Doce años después,¿y para que vamos a cambiar el cartel? http://t.co/e0N0fI4y",NONE
156431271353004033,"Siempre habrá clases RT ""@europapress_es: Rolls-Royce logra la cifra de ventas más alta en sus 107 años de historia - http://t.co/d1OczP7J""",P
148853951868059648,Holaaa mis tweeps! Un dia maravilloso para hacer un twitcam como os he prometido sera a las 6:00 pm (hora de Mexico) nos vemos pronto!!!,P
186143730380718080,"Consolida la empresa, supera  objetivos, bate a la competencia ¿reconocimiento? Ninguneo y  miseria para administrar. Cómo no va a irse SG?",NEU
164671107515953153,RT @DavidGerboles: Rivera recuerda a Rajoy que el PP prometió ajustar las leyes tras la sentencia sobre el Estatuto | http://t.co/pPlNefrr,NONE
819390895174930432,@vernonist ¿en serio? :0 aprendo gracias a un sitio que una amiga me recomendó y ahora estoy viendo unos videos,NONE
144411865873788928,A las 3 en @A3noticias os contaremos algunas de las noticias sobre las que más se ha tuiteado en 2011,NONE
151958022716014592,Una de las personas con las que mas me gustó hablar ayer en el Congreso: El gran Gistau. Y me contó xq ya no anda por aquí...,P
800547473341218816,"@francellabrenes Rajado, y mientras llega acá",N
818619080890585089,El mejor #piropo de mi vida «estás #buchisapa y pareces un #kion»,N
174938567695536128,Fin de la jornada! De camino a casa! Deseando ver a mis chicas!;-),P
154911907902521345,"Queridos Reyes Magos, este he sido muy buena, solo quiero un ático en el Centro de Madrid, para ver más a mis amigos,( ya lo pago yo si eso)",P
813407245337849856,@alevar13 me la pasas? Mi playlist feliz necesita actualización,NONE
164039565806546944,"Eso es! RT @Rovillegasb: @mariviromero desde luego que para una vez que los medios nacionales nos iban a hacer caso ""en exclusiva""...",N
180147563280867328,Buenas noches guerrer@s. escojan bien sus batallas .. Hasta maÑana..,P
817592024329285632,@fioyaz Es que tu tuit me recordó a un diálogo de una serie muy graciosa que yo veía seguido antes. Pero no es,NONE
149962270330470401,"¿Monarquía? ¿República? Entre los más jóvenes, las preferencias están empatadas. En el blog de Toharia http://t.co/QYgazAvj vía @el_pais",NONE
798395934359089153,"@David_Gato5 Mae esque mi top 3 son Dez Bryant, A. Brown y OBJ La de Zek viene de cuarta",NONE
170248912194646016,"No necesito saber derecho para discrepar de una sentencia, y  mucho menos cuando no es justicia, es un linchamiento político y corporativo.",N
163916294075334656,"Esas empresas ""modelo""? RT @m__jimenez: Google, Apple y Microsoft pagan impuestos mínimos fuera de EE UU http://t.co/zEjXMnof vía @el_pais",N
182062652082749440,"Aprobado presupuesto del #Congreso para 2012. 5,2% menos que en el 2011.",N
808143467083862016,"@franky2055 que dichoso ya casi terminas, yo apenas voy por el 85 jaja",NEU
770702082265518081,"He decidido empezar a procesar las fotos macro del verano 
https://t.co/M7NkkPI4f2 https://t.co/K0HOtoDz4c",NONE
187608330569662467,"La situación es complicada, pero el Gobierno sabe lo que tiene que hacer para que España vuelva a crecer y crear empleo http://t.co/lqomZHQ9",P
769620100475449344,@Nuchiky está en textos en inglés y voces en japonés. Que desilusión me he llevado al poner el juego  habrá que acostumbrarse 😕,N
183931998337908737,"Esta misma noche, sin digestión de los resultados, Rajoy vuela a Seúl, donde tendrá un encuentro informal con Obama",NONE
158697970106241026,"Veo que mi educado #trolldeldía, el de ""cara de rana"", es periodista de Intereconomía en Granada https://t.co/fwT98Fks",NONE
183986505994350592,;-)))))) RT @elisa_cj: En la sede del @ppandaluz se respira tranquilidad #25M #Andalucía,P
176413472991621120,"¡Qué gran sueño, querido @Panchovarona! En cuanto se cumpla celebramos.",P
184054337041989632,"Mirad. ¡Me he comido una ""h"" por segunda vez en el día de hoy! Y me disculpo por segunda vez. Lo siento. Pero estoy cansado. Bona nit.",N
172799794102804480,hahaha “@Absolutexe: @PilarGGranja @noelia_atance esto os va ha hacer sonréir http://t.co/bb1zHrBr”,P
769902370755084289,Mi padre le ha dado un manotazo a mi móvil y gracias a Dios que lo que se ha roto ha sido el cristal templado ,N
812818652470706181,@EntelPeru ningún inconveniente. Excelente servicio! 4G al máximo... Felices fiestas navideñas,P
186199644496334849,"En 2 segundos lo q otros tardan 1 mes. RT @elmundo: Amancio Ortega ha ganado 448 euros cada segundo esta semana http://t.co/FdfHYdT1""",NEU
184636611378679808,Las ofertas de última hora de http://t.co/5rR3tfOA son la bomba. Desde 25€/persona y noche...,P
804176696761008128,"Hoy le dije a mi mamá: ""Para cerrar Noviembre solo falta un temblor"". Listo! Ahora digo q pa cerrar el 2016 solo falta pegarme el Gordo",P
186902484478988288,"Son la bomba !!! Espectacular ClementeClon!!! En @Fede_dejuan @LosClones me muero de la risa, hahahshahshshaha",P
818187302073761801,@mariagraciav gracias! y aun no se que dia pero creo que el 12/13 estare libre en Lima,NONE
771014163896340484,"@voicesyntex soy como ese medio demonio que es marginado por los demonios, pero también por los humanos ",N
148761384988065792,Los primeros análisis en EL PAÍS sobre el discurso de Rajoy. Miguel Jiménez analiza la economía http://t.co/MT8BeRtO,NONE
167382927913656320,Uyy que se me olvidaba dejaros esta pagina para que os apunteis a la Marcha del sabado dia 12 @CarnavalMLG @malagasana http://t.co/tw76mtG8,NEU
179134841915326464,Hoy reunión con hosteleros del #CentroHistorico #elcambioandaluz (@ Cafe Central) [pic]: http://t.co/7bEst9gC,NONE
809572417131737088,"@camilaguimasr y lo sabes , cosas muchas mejores vendrán",NONE
186937515377299456,Estamos entre bambalinas http://t.co/9qsBg5bm,NONE
768580520821329921,Mañana es muy probablee que caiga un directo!! Y ya sabeis lo que pasa en los directos... ,NEU
146527542386499584,"AMAIUR tendrá grupo solo con diputados del PVasco. El de Navarra (le faltaban unas décimas para 15%), no tomará posesión, de momento",N
166099036561088512,El @ppmalaga apuesta por una política sanitaria centrada en personas y no en eslóganes  http://t.co/UkWITR4d @eliasbendodo @esperanzaona,P
164045826807697410,"Tres ministros, el presidente del Congreso y toda la ""crem"" judicial en la toma de posesión de Torres-Dulce http://t.co/FKqTDIAe Y tb Garci",P
811792680271380480,"puxa, @abocajarroperu como te pasea @JorgeDCG? alli si no eres inquisidor!",NONE
173014435512844288,Un abrazo para los compañeros de @Publico_es,P
816078082398265346,"Regresé de la playa hoy y literal todo el día he dormido, y aún sigo con sueño",NONE
162669824684732416,"Mañana a las 12 AM Cine Palafox calle Luchana pase gratuito para followercetes (Hasta llenar aforo) de la peli ""Lobos de Arga""#cinematutino",P
810947541370097666,Es grandioso conocer a personas maravillosas como ustedes @lasabesaba @vanessasaba75 se quedan en el corazón de las que las conocen.,P
809243444216524800,@NoticiasCNCO ya conozco a 3 pero Erick que es mi favorito no y Joel,NEU
174544481859813376,Nos vemos en @TDtarde con @nievesherrero_ a partir de las 18:45 y con @susmoneo @JesusCintora @GOTZONEMORA Mari Pau y @lodares de invitado.,P
156383436108607488,. @EliasBendodo  asegura que la Diputación ha generado un impacto económico...: http://t.co/in7Jnedq vía @malagahoy_es,N
158682806543847424,"Con Michael thomas, Jose Angel Velez y Don Luis Rogelio Rodriguez http://t.co/9oulLSnk",NONE
796715835888988160,Cuando yo vi al Pipi aquí en la conferencia de prensa casi lloro como ese niño Pero solo estaba ahí temblando,NONE
770169656451731456,"Al principio él no te gusta , pero te acaba gustando y cuando te deja lo extrañas ",NEU
799448567626743808,El otro año va a ser diferente y tiene que ser diferente,P
161788315698339841,"""No hay ningún informe q indique q #ETA vaya a actuar"", coinciden Mº Interior y Cjero vasco. Pero recuerdan: ""no ha desaparecido""",NEU
158558829989199872,"Anoche jugando hasta las tantas a ""atrapa un millon"" con @_Aliflor_  y @Wallchairfloor Me encanta!!!! http://t.co/x0vPFfcz",P
158702293183770624,"La mejor parte es cuando Rajoy presenta a Fraga como un ministro de Información que se la jugó en el franquismo por ""reformista"".",N
799401064210501632,Bueno hoy fui a almorzar a Nanay con otras 3 dras xq la capacitación mal organizada no nos dió almuerzo y encima nos mandan a comer 2pm,N
169547319103066113,RT: lo que se agencian las agencias “@quediario: Avance de la portada del diario Qué! miércoles 15 de febrero http://t.co/2mdWPWEz”,NEU
156640316491964416,"Son los riesgos de hacer cine ""alternativo"".",N
142521249246097408,"abcdesevilla.es: Cuatro altos cargos de Empleo, denunciados por retirar la prejubilación a extrabajadores http://t.co/LWHxzbuB",N
162335882332999680,Buenas noches. Súper orgulloso de mi equipo. Hay cosas con las que no se puede luchar. Hoy el fútbol lo ha puesto el madrid. Muy superiores.,P
819337926026862593,Antojo de empanada colombiana,NEU
774804336236978177,"Las remuneraciones económicas son lo que todos esperan, pero un ""me encanta lo que has hecho"", lo vale todo. El cliente es primero.",P
179086377932169218,Propongo q Defensor del Pueblo investigue contribución al enfrentamiento civil promovido diariamente x cierta derecha mediática y tuitera.,N
162781584913727488,Twitter no aclara cómo determinará q contenidos son inadecuados en algunas culturas/países.El bloqueo dice x solicitud d entidad autorizada,N
187602614903513089,"Curiosidades del CIS: la reforma laboral apenas es mencionada como uno de los problemas de España (1,2%); el desempleo abruma (84%)",N
811915425189609473,Se acaba un año muy productivo en memes,NONE
770189062565158912,"@TeoGarciaEgea @paconadal De nuevo, encantado. Y a mi tampoco me gustan esos titulares tendenciosos. Pero tampoco los opuestos  Saludos.",NEU
767764798738206721,Ya a saber cuando vuelves a hacer un #FollowExpress  lloro @BlasAuryn,N
146897959894790145,Comprar en Torremolinos en Navidad tendrá un premio de 15.000 euros  http://t.co/Mr5eGo2E,P
769766061126344704,"Después de casi un mes entero sin él... puff, espero no echar temporadas tan largas sin verlo ",N
150524454441721856,La mejor forma de garantizar la seguridad de nuestras tropas en el exterior es no enviarlas donde nadie nos llama. Retirada de Afganistán!,N
144317421958856704,"Nadie le cree, pero jura y perjura q sí, q deja la política y se va a Walt Disney. Los corrillos del Congreso con @susannagriso",NONE
158516822692462592,"""Debemos tener la capacidad de vertebrar la sociedad española. Tenemos que ser coherentes en toda España.""",P
155063352064872449,@jesusmarana Qué buena la foto de portada.,P
148155950921031680,"Muy hábil Callejón. El se merece el gol, pero el Madrid no se merece ir ganando por dos.",NEU
768091548995227648,@kurokatze_ si es eso  pero bueno yo que se cada uno tiene sus gustos porque xd amiks,NONE
186854216990605312,"El PSdeG dice que Feijóo ""ya tiene su Prestige"". Yo creo q quien ansia un Prestige es el PSOE. #LoLlamanCarroña a ese tipo oposicion",N
818143683417690113,Es criminal que me hagan caminar tanto hoy,N
154929166163263489,Y a mi también “@chefidiaz: Me da vergüenza leer ésto http://t.co/uUfsEpBW”,N
166875386427346945,“@rdelvalle: Qué pena que @JuanraLucas no sea Pedro Piqueras. Entonces sería Juan Dramón Lucas #jajaja #socorro #mátenmeYA” Yo el primero :),P
157884386757443584,"Se llama ""sombra y luz"" me alegra que te guste RT @monsherrygirl: @AlejandroSanz  como se (cont) http://t.co/7H79Q6zw",P
179323716386291714,Totalmente RT @eliasbendodo: Y el ganador del debate es..................@javierarenas_pp  Pensadlo bien.,P
143256062743691264,. @JavierArenas_PP  critica que @PepeGrinan pida a @MarianoRajoy una reunión que niega a sus alcaldes  http://t.co/5oMAB1Us,N
174257469487464448,Mañana voy al desayuno informativo de Barcina. Tengo la oportunidad de hacer una pregunta por escrito. ¿Cual harías tú?,P
170534602065199106,La Policía italiana se incauta de 6 billones de dólares en bonos del Tesoro de EEUU falsificados - http://t.co/aZgfiVr3,N
169132789055225858,"Eso es RT @chikostra: @mitaddoble @mariviromero Sin duda, El tiempo entre costuras… Tanger, calor, aventuras y todo magníficamente relatado.",P
182144977743261696,Un resumen de nuestras alegaciones al Plan de Calidad del Aire de Madrid: http://t.co/Xmg0vdcK,NEU
163578334922555392,Y el tercer premio ganador de  2 entradas es para este disfraz de @juniornoriega http://t.co/dy7NggIw,P
160132885104443393,Aquí está la entrevista de esta mañana en @ElCirculoTM #TeleMadrid http://t.co/VjLL3qSL,NONE
175206955537793028,Desde el Consejo de RTVE me aclaran q lo de Clan y Teledeporte se ha sacado d madre.Era un ejemplo dq los recortes afectarán a la parrilla,N
143591708486148097,"Mas es presidente autonómico porque tenemos autogobierno gracias a la Constitución,pero ni la cumple ni la hace cumplir #fueradelaley",N
769615173141295104,He probado una nueva espuma para el pelo y sí que lo deja más rizado pero se queda como efecto gomina y no me gusta. ,N
144819507289001984,Los videos sobre la final de la Copa Davis subidos a Youtube alcanzan más de 580.000 visitas #copadavis,P
186173360600911873,"Impresionante cristiano, Impresionante.",P
770708719206301696,@JCesarPL @GuidoBCor Faltaría. Pensaba en cómo se construyen los discursos y quiénes los emplean. Es un debate interesante. ,P
805030196265054209,Me hice un sándwich. En vez de queso le puse leche condensada y aún así lo puse a tostar,NONE
149898474647863296,"RT @lluvia_rojo: Gracias @JuanraLucas por la entrevista de ayer con
 @nobandforlluvia  Disfrutamos mucho. Gracias a vosotros. Besos",P
165127715094142977,Breikennius!!! “@eitbcomNoticias: La marmota Phil predice un invierno de seis semanas más #diadelamarmota http://t.co/Vl7NsZHK”,NONE
162453693260759042,“@xaavihdez: Te ha gustado el revuelto del AVE?” Cojo el AVE sólo para degustarlo.,N
167219313042931712,"Rajoy se aclimata y dice que no es dogmático del déficit  ni sectario, pero se muestra paternalista con el grupo mixto.",NEU
163392994496618497,¡¡¡¡HALA MADRID!!!!,P
189621874685251585,Vamos a vigilar que las CCAA cumplan os objetivos de déficit.. @c_floriano en #losdesayunosdetve,P
758521854822797316,"Estábamos subrayando en Sociales y el apellido de un mae era ""Kagame"", y soy tan inmadura que no paré de reírme por casi toda la lección.",P
770228440985468928,"@suomijon @chemiF1 @WinfieldF1 ... bien pienso que tú te enquistas en temas secundarios sin ver ""toda la película"". ",N
188729684102623233,Gran entrevista a Carrillo en el 35 aniv. d la legalización del PCE. El partido fundamental de la resistencia y el logro de la democracia,P
162313540705853441,"Sergio Ramos, o las mil formas de NO sostener una Copa del Rey entre sus manos. Capítulo II.",N
175139437443940352,"Buenos días,hoy nos reunimos la Ministra y yo con el Consejo para la igualdad. Órgano q trabaja por evitar conductas xenófobas y excluyentes",P
158932375953354752,El eterno refugio de Fraga en Perbes - ABC.es http://t.co/DkngArLd via @abc_es,NONE
159400785078267904,"En @La_SER @garciapage dice q se presentará ""si llega al convencimiento de q las 2 opciones se anulan y son malas para el partido"".",NEU
186947141485330432,"Buenas noches. He salido a acompañar a mi visita y había llovido, y me he dado cuenta de que ya no me acordaba cómo huele después de llover.",NONE
154586739216879618,"Esto no puede faltar en la estantería de un madridista, #epico te lo gestiono @gonzalococa ! ;-) http://t.co/2L5MZp25 #HistoriaReal",P
791318710132805632,Hoy no es un gran día ,N
152669721337143297,"Feliz Viernes a todos! el último del 2011, Ole Ole Ole.....",P
165468612302340096,"@Sorayapp perfecto, lo estábamos esperando como agua mayo. Enhorabuena. Estáis dando en el clavo d los deseos d cambio en España.",P
179882571050651648,Enhirabuena RT @borissoler: A las 12h. presentamos #HairAcademy  #FuertesyHermosas ojala hubiese mas personas como tu http://t.co/ja9SVWQq,P
812706599609520128,@jpguillenz a mí solo esos villancicos me gustan,P
148547089243189249,EL DIGITAL recoge su premio concedido por ASAJA Ciudad Real http://www.eldigitalcastillalamancha @eldigitalcastillalamancha. Enhorabuena,P
180682690205462531,El Gobierno suprimirá empresas públicas con más consejeros que trabajadores en plantilla http://t.co/moRR8YQw vía @elmundoes,NEU
817864316372348928,no encuentro ninguna buena serie en NF.,N
187604088182161408,Argentina podría utilizar los fondos de jubilados para comprar YPF. Cotización de Repsol ya descuenta la nacionalización,N
159562049687523328,"ALLÍ NOS VEMOS!!! Madrid,19 de enero: Acto de presentación del Aula de Liderazgo Público http://t.co/gMbBaXoY vía @masconsulting",NONE
161767764648919040,Brasil aumenta tensiones con Iran http://t.co/3AyCHlfS,N
770068054688620544,"@jose97angel ay, ayer cuando lo publicaron y lo vi me entró un sentimiento más grande por dentro...   ",NEU
173127115489812481,http://t.co/cGwsD1ic,NONE
185442272173760512,"Toxo a Rajoy: ""No se puede arruinar tres décadas de diálogo social sin pagar las consecuencias"".",N
168962129662193664,Portada As http://t.co/JjO3BfOW ...,NONE
149075083837714434,"Rajoy a Antigüedad: ""Yo a usted no le debo absolutamente nada"". Aplausos cerrados de los escaños del PP. ""Muy bien"", dicen los diputados",P
169532726133800962,le gusta Everything You Do de Luther Russell  en Ping http://t.co/Lcagi8Yb #iTunes,P
187238987683991552,Brillante artículo en ABC de Ignacio Camacho sobre Mingote.  Un español tan claro http://t.co/iT4WogeJ via @abc_es,P
182041481236856832,"Morosidad bancaria casi en 8%, como en 1994 ¿Diferencia? Aquella crisis, intensa pero de año y poco. Esta ya 5 años y sin atisbo de mejora",N
796828749488590848,"Super Junior es un escape a todas las cosas malas que pasan en mi vida, es por eso que al apoyarlos no lo veo como una obligación",P
185331638534799361,"La ministra Báñez se agarra al dato del consumo de energía que, según ella, es menor que en otras huelgas.",N
770702799470489601,@lantoli podemos usar el término.equipo pepino ,NEU
806648340746223616,"@luquenukem pucha, yo completé el pokedex Perú, solo me faltan los regionales que dudo los consiga y a esperar los legendarios",NONE
161768042035036160,El Nuñez crackoviano ayer... http://t.co/5FahOkqz,NONE
768228346232729603,"@JCLilGangster yo tengo que aguantar 4 niños pequeños, no sé que es peor ",N
185486956715716610,"Pues sí “@emilio2259: Esperanza Aguirre, sobre la huelga general: «Estos sindicatos caerán como el muro de Berlín» http://t.co/Lkvg3w5E",N
179449646727434240,Ocampo: 'Pensar que Joseph Kony va a dejar de secuestrar niños no tiene fundamento' http://t.co/DlXTg5lv via @rtve,N
770025123118215168,"El puente mas bonito de la constitución este año en Alicante 12,13 y 14 @zaharapop en directo y allí estaré ",P
161402822758379520,"#Andalucia necesita claridad en sus cuentas, transparencia y rigor . Por eso es tan necesario #elcambioandaluz",N
189814854503235584,Más pobres por discriminar a la mujer http://t.co/4T29uZlh,N
768099192451502080,"@HawkersCo @Hawky_  #NecesitoElViajeAAndalucia bueno si un tal premio al mongol o algo así, pero eso era malo ",N
768526478720065536,"#Otegi inhabilitado   #EsLaSentencia 
Mujeres tapadas hasta los ojos #EsSuCultura
Teneis un sentido inamovible del mundo y de la vida.",N
813270032591572992,Un saludo a mi crush del segundo semestre del 2016! Ya casi se acaba el año y dejará de ser mi crush y nada de que me dio pelota,N
188230550757183488,En la tele no hay fiestas que valgan http://t.co/gGzeW5RQ,N
159961946043592704,Que tipo de empleo se ha creado en US ultimos años ? Lecciones a sacar http://t.co/9P9Q4El5,N
160423165896560641,Besos RT @lakiki_21: @AlejandroSanz jamas me dara RT :(,NEU
767758700169879552,Hay videos que no se envían porque no tengo espacio en el móvil así que lo siento ,N
161706142840524801,Portada La Razón http://t.co/cxQ5clS9 ...,NONE
168614286594293760,Soledad Gallego Díaz sobre la condena a Garzón: http://t.co/kk632o3y,N
767840587294842880,@ULPGC hola   ¿me podrían seguir para hacer una consulta por Mensaje Directo? Muchas gracias,NONE
169886423892230145,Asi hacen desde el @psoeandalucia traspaso de fondos entre consejerías de manera irregular http://t.co/hwC8LU89 vía @antoniosanz,N
796074815740329988,"@fioteca Sí, no sé por qué no me caía para nada que Taylor esté con Ryan y el supuesto activismo de Summer. Extrañaba a Marissa.",NONE
169376485965168640,"Se me ha estropeado la caldera. Un técnico llega a los 3d, sin piezas y dice q volverá pasado mañana. #nadietrabaja 1/2",N
770212600881766400,lo mejor de to es que me examino justo el dia de mi cumple pero bueno la vida ,P
814995423458983936,En pocos minutos empieza Combate!! Usa el HT #CbtHastaSiempre y coméntanos que fue lo que más te gusto de tu programa favorito...,NONE
183283789282279424,".@javierarenas_pp "" le vamos a ganar la partida a los mercaderes del miedo. El único miedo que he captado es el miedo a que todo siga igual""",P
810701756791484416,@SanzZeriTica y qué? No será la primera vez,NONE
173356871573450752,¡Noticias descombacantes! está disponible! http://t.co/pdWFYyRa,P
802019134255099909,"Ese es el problema, que la mayoría de personas se confían cuando el huracán toca tierra sin saber que la parte este es la más peligrosa",N
149864939056660480,Se retrasa el Pleno #AsambleaMadrid a las 16:30h,N
767432328381693952,En realidad no soy tan blanca ,NEU
163926978590810113,"Buenos días desde Puerto Rico, hoy empezamos a trabajar muy temprano.saludos.",P
154686691800653824,Mañana saldremos a la venta con el segundo concierto de Lérida que será el domingo 15 de abril,NONE
816158587873542144,"@gabrielselva_cr esa está genial en serio, vamos, vamos un día",P
179686844156489728,#momentodormir Byes,NONE
166970696155676672,Qué grandes los periodistas gráficos andaluces! Exposición de los premios d Andalucía 1988-2011 en el Museo de la Autonomía en Coria del Río,P
158661073979977728,Por hoy twitter off. Que mañana sea un buen día.,P
156996332035383297,Portada El País http://t.co/4g4z8h4p ...,NONE
162232155630600192,"A los 14 años una menor es lo bastante adulta para casarse en España sin consentimiento paterno. A los 13, para tener sexo con adultos.",NONE
768521153002569728,en realidá é algo duro de asimilar ni el alcohol me ayuda ,N
799769607921958912,"@magnobolivar 1) wordpress es más pro. 2) Yo tengo un blog, pero mis lectoras son más de estilo upsocl y buzzfeed, eso aún se lee",NEU
802656976664727552,Cansado es poco. Pero saber que hoy se ayudó en algo me hace feliz.,P
151365636411498496,Un cibermundo muy social http://t.co/e00gttbl,P
173390338851999745,aunqu repetido muchas veces no esta mal recordarlo.“@NYTimeskrugman: European Crisis Realities http://t.co/1ikOUCSd”,N
154629892913364992,"Carmen Martínez de Castro ha fichado a Consuelo Sánchez Vicente, periodista y tertuliana para La Moncloa.",NONE
169330698866540545,Que en un pais tan preocupado por la moralidad no parece raro q el favorito sea un Santo...rum ;-) http://t.co/mwGl0JDT,NEU
157202207815634945,"""QUIEN NO HA AFRONTADO LA ADVERSIDAD NO CONOCE SU PROPIA FUERZA""         http://t.co/Zo7IT1Y2",N
814810244299845632,@oooogeiD por mensa Yo supuse que era un toque más caro pero esa María tenía tarifa dinámica,N
772796443623129095,@DesireeDelgado yo llevo medio verano debajo de la dichosa máquina... menudo verano largo este año de sofoco... ,N
146194489449521152,"Cruz está que de sale RT ""@agusperezblanco: Miguel carcaño; así vive en la cárcel. Muy bueno el répor de @cruzmorcillo http://t.co/PBJDVbA2""",P
770982171142189056,"@aaron_np @OjeraFarlopera_ @livetodie77 @Nerea_RMCF93 no tenemos para cerveza, somos pobres y sucios. No nos dejan entrar al bar ",N
811910807743303680,"#MePasóPorPavazo @MananaMaldita Amigo que guapo eres, mi amiga y yo queremos hacer un trio, y yo todo ganador, Me pepearon @Marcuilas",N
166890265355878400,Que maravilla.. Un abrazote para toda mi Andalucia de mi alma. RT @macasanzlucero1: @AlejandroSanz (cont) http://t.co/3On5fZrP,P
144160529227849728,"Ahora si que me despido! a lavar los piños y ¨pa¨ la cama! Hola @lucia_miguel un beso de buenas noches para ti, que veo que acabas de llegar",P
153038482443472896,Buenos días. Espero que esta noche merezca la pena.,P
818269038702956549,"@paunik oh. los mios tampoco, asi que por eso lo veo solo, en la tele vieja",NONE
786045194911174656,Siempre ando metida en google buscando imágenes lindas  si me encanta. de lo que sea me gustaría que sean solo para mi pero no se puede,NONE
166116260776656897,"La nueva Ejecutiva PSOE: aparato, aparato, aparato. Muy Fiel al ganador y demostrando que la integración es imposible. A saco y en caliente",NEU
